{
  "schema_version": 1,
  "skill": "worktree-isolation",
  "provenance": {
    "owner": "lizard-agent-layer maintainers",
    "reviewed_at": "2026-07-12T00:00:00Z",
    "review_record": "docs/adr/0008-loop-lifecycle-and-no-auto-merge.md"
  },
  "compatibility": {
    "hosts": ["windows-powershell-5.1", "windows-pwsh", "linux-pwsh", "macos-pwsh"],
    "model_classes": ["legacy", "current"]
  },
  "fixtures": [
    {
      "id": "external-worktree-registered",
      "kind": "positive",
      "test_path": "tests/adversarial/worktree-external-mutator.tests.ps1",
      "assertion_pattern": "Existing worktree registration failed",
      "description": "Registers an externally created clean worktree and binds its lifecycle evidence without product-owned Git mutation."
    },
    {
      "id": "external-git-mutation-fails-closed",
      "kind": "negative",
      "test_path": "tests/adversarial/worktree-external-mutator.tests.ps1",
      "assertion_pattern": "Built-in Git worktree mutation must fail closed",
      "description": "Rejects built-in worktree creation and cleanup where Git cannot consume the SafeFs handle boundary."
    },
    {
      "id": "nested-worktree-rejected",
      "kind": "negative",
      "test_path": "tests/adversarial/loop-evidence.tests.ps1",
      "assertion_pattern": "Target-contained worktree must be rejected",
      "description": "Rejects a worktree destination contained by the target repository."
    }
  ]
}
